{
  "$schema": "https://json-schema.org/draft/2020-12/schema",
  "$id": "https://weaver-spec.dev/contracts/v0/extended/otel_trace_mapping.schema.json",
  "title": "OtelTraceMapping",
  "description": "Extended. Mapping of a Weaver TraceEvent onto an OpenTelemetry span — carries the OTel trace/span identifiers and the GenAI semantic-convention attributes that downstream observability tools consume. The full field-by-field mapping is documented in docs/OTEL_MAPPING.md, pinned to the OTel semconv snapshot referenced there.",
  "type": "object",
  "required": ["trace_id", "span_id", "span_kind"],
  "properties": {
    "trace_id": {
      "type": "string",
      "minLength": 1,
      "pattern": "^[0-9a-f]{32}$",
      "description": "OTel trace identifier. 32 lowercase hex characters per the W3C Trace Context (https://www.w3.org/TR/trace-context/#trace-id)."
    },
    "span_id": {
      "type": "string",
      "minLength": 1,
      "pattern": "^[0-9a-f]{16}$",
      "description": "OTel span identifier. 16 lowercase hex characters per the W3C Trace Context (https://www.w3.org/TR/trace-context/#parent-id)."
    },
    "span_kind": {
      "type": "string",
      "enum": ["INTERNAL", "CLIENT", "SERVER", "PRODUCER", "CONSUMER"],
      "description": "OTel SpanKind. See https://opentelemetry.io/docs/specs/otel/trace/api/#spankind."
    },
    "gen_ai_operation_name": {
      "type": ["string", "null"],
      "description": "Value for the OTel attribute `gen_ai.operation.name` (e.g. `chat`, `text_completion`, `embeddings`, `agent.invoke_agent`, `execute_tool`). See https://opentelemetry.io/docs/specs/semconv/gen-ai/."
    },
    "gen_ai_agent_id": {
      "type": ["string", "null"],
      "description": "Value for the OTel attribute `gen_ai.agent.id`. Stable identifier of the agent or capability owner."
    },
    "gen_ai_agent_name": {
      "type": ["string", "null"],
      "description": "Value for the OTel attribute `gen_ai.agent.name`. Human-readable name of the agent."
    },
    "gen_ai_tool_name": {
      "type": ["string", "null"],
      "description": "Value for the OTel attribute `gen_ai.tool.name`. Derived from TraceEvent.capability_id by the mapping in docs/OTEL_MAPPING.md."
    },
    "gen_ai_system": {
      "type": ["string", "null"],
      "description": "Value for the OTel attribute `gen_ai.system`. Identifies the AI system that produced the event (e.g. `anthropic`, `openai`, `weaver`)."
    },
    "parent_span_id": {
      "type": ["string", "null"],
      "pattern": "^[0-9a-f]{16}$",
      "description": "Optional parent span ID for nested operations. Same format as span_id."
    },
    "semconv_version": {
      "type": ["string", "null"],
      "description": "OTel semantic-conventions snapshot the producer mapped against. Mirrors the `semconv_version` value pinned at the top of docs/OTEL_MAPPING.md."
    }
  },
  "additionalProperties": true
}
